{
  "fixtureScope": "examples_not_full_786_diagnostics",
  "fixtureType": "equipment_unresolved_examples",
  "records": [
    {
      "blocking": true,
      "candidates": [],
      "code": "equipment_class_requirement_unresolved",
      "equipmentId": "wpn_22",
      "evidenceRefs": [],
      "fieldPath": "classRequirements",
      "id": "equipment_diagnostic_class_requirement_missing",
      "notes": [],
      "reason": "DB.items omits req; omission is not equivalent to all classes.",
      "sourceLocation": "js/00-data.js#DB.items.wpn_22",
      "status": "unresolved",
      "valueState": "missing"
    },
    {
      "blocking": false,
      "candidates": [],
      "code": "equipment_description_missing",
      "equipmentId": "wpn_22",
      "evidenceRefs": [],
      "fieldPath": "description.canonicalText",
      "id": "equipment_diagnostic_description_missing",
      "notes": [],
      "reason": "DB.items omits canonical description text.",
      "sourceLocation": "js/00-data.js#DB.items.wpn_22",
      "status": "unresolved",
      "valueState": "missing"
    },
    {
      "blocking": false,
      "candidates": [],
      "code": "equipment_mechanic_unresolved",
      "equipmentId": "relic_croc_soul",
      "evidenceRefs": [],
      "fieldPath": "mechanicRefs",
      "id": "equipment_diagnostic_mechanic_proc",
      "notes": [],
      "reason": "procSkill fields require later mechanic extraction and a verified skill EntityRef.",
      "sourceLocation": "js/00-data.js#DB.items.relic_croc_soul",
      "status": "unresolved",
      "valueState": "unresolved"
    },
    {
      "blocking": true,
      "candidates": [],
      "code": "equipment_price_conflict",
      "equipmentId": "relic_shadow_stinger",
      "evidenceRefs": [],
      "fieldPath": "price.amount",
      "id": "equipment_diagnostic_price_conflict",
      "notes": [],
      "reason": "DB.items.p and Wiki price disagree.",
      "sourceLocation": "js/00-data.js#DB.items.relic_shadow_stinger.p",
      "status": "review_required",
      "valueState": "conflict"
    },
    {
      "blocking": false,
      "candidates": [],
      "code": "equipment_relation_unresolved",
      "equipmentId": "acc_116",
      "evidenceRefs": [],
      "fieldPath": "relations",
      "id": "equipment_diagnostic_relation_name_html",
      "notes": [],
      "reason": "Legacy Wiki drop sources are HTML/name-based and are not canonical relation keys.",
      "sourceLocation": "wiki.html#EQUIP_DATA.acc_116.sources",
      "status": "unresolved",
      "valueState": "unresolved"
    },
    {
      "blocking": true,
      "candidates": [],
      "code": "equipment_runtime_mutation_unresolved",
      "equipmentId": "wpn_claw_bronze",
      "evidenceRefs": [],
      "fieldPath": "mechanicRefs",
      "id": "equipment_diagnostic_runtime_combo",
      "notes": [],
      "reason": "comboRate is supplied by deterministic runtime enrichment rather than the base literal.",
      "sourceLocation": "js/10-ui-tabs.js#comboRate enrichment",
      "status": "unresolved",
      "valueState": "unresolved"
    },
    {
      "blocking": true,
      "candidates": [],
      "code": "equipment_safe_enhance_unresolved",
      "equipmentId": "wpn_22",
      "evidenceRefs": [],
      "fieldPath": "safeEnhance.safeLevel",
      "id": "equipment_diagnostic_safe_enhance_missing",
      "notes": [],
      "reason": "DB.items omits safe and noEnhance; no safe value may be inferred.",
      "sourceLocation": "js/00-data.js#DB.items.wpn_22",
      "status": "unresolved",
      "valueState": "missing"
    },
    {
      "blocking": true,
      "candidates": [],
      "code": "equipment_source_precedence_conflict",
      "equipmentId": "relic_strong_femur",
      "evidenceRefs": [],
      "fieldPath": "price.amount",
      "id": "equipment_diagnostic_source_precedence",
      "notes": [],
      "reason": "Canonical DB.items.p wins over the Wiki migration projection, while the mismatch remains reviewable.",
      "sourceLocation": "docs/EQUIPMENT_SOURCE_PRECEDENCE.md",
      "status": "review_required",
      "valueState": "conflict"
    },
    {
      "blocking": false,
      "candidates": [],
      "code": "equipment_weight_unverified",
      "equipmentId": "wpn_22",
      "evidenceRefs": [],
      "fieldPath": "weight",
      "id": "equipment_diagnostic_weight_unverified",
      "notes": [],
      "reason": "Legacy Wiki weight has no verified canonical runtime source and is excluded from Equipment schema.",
      "sourceLocation": "wiki.html#EQUIP_DATA.wpn_22.weight",
      "status": "unresolved",
      "valueState": "unverified_claim"
    }
  ],
  "schemaVersion": "1.0.0"
}
